{
  "$schema": "https://json-schema.org/draft/2020-12/schema",
  "$id": "world.schema.json",
  "title": "ASCII city world tile",
  "type": "object",
  "required": ["terrain", "buildings", "surfaces", "props"],
  "$defs": {
    "point": {"type": "array", "prefixItems": [{"type": "number"}, {"type": "number"}], "minItems": 2, "maxItems": 2},
    "provenance": {
      "type": "object",
      "required": ["source", "url", "license", "retrieved", "confidence"],
      "properties": {
        "source": {"type": "string", "minLength": 1},
        "url": {"type": "string", "pattern": "^https://"},
        "license": {"type": "string", "minLength": 1},
        "retrieved": {"type": "string", "format": "date"},
        "confidence": {"type": "number", "minimum": 0, "maximum": 1},
        "method": {"type": "string"}, "clipped": {"type": "boolean"}
      },
      "additionalProperties": true
    }
  },
  "properties": {
    "terrain": {
      "type": "object", "required": ["resolution_m", "origin", "elevations", "provenance"],
      "properties": {
        "resolution_m": {"type": "number", "exclusiveMinimum": 0},
        "origin": {"$ref": "#/$defs/point"},
        "elevations": {"type": "array", "minItems": 2, "items": {"type": "array", "minItems": 2, "items": {"type": ["number", "null"]}}},
        "provenance": {"$ref": "#/$defs/provenance"}
      }, "additionalProperties": false
    },
    "buildings": {
      "type": "array",
      "items": {
        "type": "object", "required": ["id", "footprint", "base_elev_m", "height_m", "color", "provenance"],
        "properties": {
          "id": {"type": "string", "minLength": 1},
          "name": {"type": "string"},
          "footprint": {"type": "array", "minItems": 3, "items": {"$ref": "#/$defs/point"}},
          "base_elev_m": {"type": "number"}, "height_m": {"type": "number", "exclusiveMinimum": 0},
          "color": {"type": "string", "pattern": "^#[0-9A-Fa-f]{6}$"},
          "provenance": {"$ref": "#/$defs/provenance"}
        }, "additionalProperties": true
      }
    },
    "surfaces": {
      "type": "array",
      "items": {
        "type": "object", "required": ["id", "kind", "geometry", "walkable", "provenance"],
        "properties": {
          "id": {"type": "string", "minLength": 1}, "kind": {"type": "string", "minLength": 1},
          "name": {"type": "string"}, "geometry": {"type": "array", "minItems": 2, "items": {"$ref": "#/$defs/point"}},
          "walkable": {"type": "boolean"}, "provenance": {"$ref": "#/$defs/provenance"}
        }, "additionalProperties": true
      }
    },
    "props": {
      "type": "array",
      "items": {
        "type": "object", "required": ["id", "kind", "x", "y"],
        "properties": {"id": {"type": "string"}, "kind": {"type": "string"}, "x": {"type": "number"}, "y": {"type": "number"}},
        "additionalProperties": true
      }
    },
    "extensions": {"type": "object"}
  },
  "additionalProperties": false
}
