{"terrain":{"resolution_m":10,"origin":[0,0],"elevations":[[95.727,95.76,95.792,95.825,95.858,95.891,95.923,95.956,95.989,96.021,96.054,96.087,96.12,96.152,96.185,96.218,96.251,96.283,96.316,96.349,96.381,96.414,96.447,96.48,96.512,96.545,96.578,96.611,96.643,96.676,96.709,96.741,96.774,96.807,96.84,96.872,96.905,96.938,96.971,97.003,97.036,97.069,97.102,97.134,97.167,97.2,97.232,97.265,97.298,97.331,97.363,97.396,97.429,97.462,97.494,97.527,97.56,97.592,97.625,97.658,97.691,97.723,97.756,97.789],[95.803,95.836,95.869,95.902,95.935,95.967,96.0,96.033,96.066,96.099,96.132,96.165,96.198,96.231,96.264,96.297,96.33,96.362,96.395,96.428,96.461,96.494,96.527,96.56,96.593,96.626,96.659,96.692,96.725,96.758,96.79,96.823,96.856,96.889,96.922,96.955,96.988,97.021,97.054,97.087,97.12,97.153,97.185,97.218,97.251,97.284,97.317,97.35,97.383,97.416,97.449,97.482,97.515,97.548,97.581,97.613,97.646,97.679,97.712,97.745,97.778,97.811,97.844,97.877],[95.879,95.912,95.945,95.978,96.011,96.044,96.077,96.111,96.144,96.177,96.21,96.243,96.276,96.309,96.342,96.375,96.409,96.442,96.475,96.508,96.541,96.574,96.607,96.64,96.673,96.707,96.74,96.773,96.806,96.839,96.872,96.905,96.938,96.971,97.005,97.038,97.071,97.104,97.137,97.17,97.203,97.236,97.269,97.303,97.336,97.369,97.402,97.435,97.468,97.501,97.534,97.567,97.601,97.634,97.667,97.7,97.733,97.766,97.799,97.832,97.865,97.899,97.932,97.965],[95.955,95.988,96.021,96.055,96.088,96.121,96.155,96.188,96.221,96.255,96.288,96.321,96.354,96.388,96.421,96.454,96.488,96.521,96.554,96.588,96.621,96.654,96.687,96.721,96.754,96.787,96.821,96.854,96.887,96.921,96.954,96.987,97.02,97.054,97.087,97.12,97.154,97.187,97.22,97.254,97.287,97.32,97.353,97.387,97.42,97.453,97.487,97.52,97.553,97.587,97.62,97.653,97.686,97.72,97.753,97.786,97.82,97.853,97.886,97.92,97.953,97.986,98.019,98.053],[96.031,96.064,96.098,96.131,96.165,96.198,96.232,96.265,96.299,96.332,96.366,96.399,96.433,96.466,96.5,96.533,96.567,96.6,96.634,96.667,96.701,96.734,96.768,96.801,96.835,96.868,96.902,96.935,96.969,97.002,97.036,97.069,97.103,97.136,97.169,97.203,97.236,97.27,97.303,97.337,97.37,97.404,97.437,97.471,97.504,97.538,97.571,97.605,97.638,97.672,97.705,97.739,97.772,97.806,97.839,97.873,97.906,97.94,97.973,98.007,98.04,98.074,98.107,98.141],[96.107,96.14,96.174,96.208,96.242,96.275,96.309,96.343,96.376,96.41,96.444,96.477,96.511,96.545,96.578,96.612,96.646,96.679,96.713,96.747,96.78,96.814,96.848,96.881,96.915,96.949,96.982,97.016,97.05,97.084,97.117,97.151,97.185,97.218,97.252,97.286,97.319,97.353,97.387,97.42,97.454,97.488,97.521,97.555,97.589,97.622,97.656,97.69,97.723,97.757,97.791,97.824,97.858,97.892,97.926,97.959,97.993,98.027,98.06,98.094,98.128,98.161,98.195,98.229],[96.183,96.217,96.251,96.284,96.318,96.352,96.386,96.42,96.454,96.488,96.521,96.555,96.589,96.623,96.657,96.691,96.725,96.759,96.792,96.826,96.86,96.894,96.928,96.962,96.996,97.03,97.063,97.097,97.131,97.165,97.199,97.233,97.267,97.301,97.334,97.368,97.402,97.436,97.47,97.504,97.538,97.571,97.605,97.639,97.673,97.707,97.741,97.775,97.809,97.842,97.876,97.91,97.944,97.978,98.012,98.046,98.08,98.113,98.147,98.181,98.215,98.249,98.283,98.317],[96.259,96.293,96.327,96.361,96.395,96.429,96.463,96.497,96.531,96.565,96.599,96.633,96.668,96.702,96.736,96.77,96.804,96.838,96.872,96.906,96.94,96.974,97.008,97.042,97.076,97.11,97.144,97.178,97.212,97.247,97.281,97.315,97.349,97.383,97.417,97.451,97.485,97.519,97.553,97.587,97.621,97.655,97.689,97.723,97.757,97.791,97.826,97.86,97.894,97.928,97.962,97.996,98.03,98.064,98.098,98.132,98.166,98.2,98.234,98.268,98.302,98.336,98.371,98.405],[96.335,96.369,96.403,96.438,96.472,96.506,96.54,96.575,96.609,96.643,96.677,96.712,96.746,96.78,96.814,96.849,96.883,96.917,96.951,96.986,97.02,97.054,97.088,97.123,97.157,97.191,97.225,97.26,97.294,97.328,97.362,97.397,97.431,97.465,97.499,97.534,97.568,97.602,97.636,97.671,97.705,97.739,97.773,97.808,97.842,97.876,97.91,97.945,97.979,98.013,98.047,98.082,98.116,98.15,98.184,98.219,98.253,98.287,98.321,98.356,98.39,98.424,98.458,98.493],[96.411,96.445,96.48,96.514,96.549,96.583,96.617,96.652,96.686,96.721,96.755,96.79,96.824,96.858,96.893,96.927,96.962,96.996,97.031,97.065,97.1,97.134,97.168,97.203,97.237,97.272,97.306,97.341,97.375,97.41,97.444,97.478,97.513,97.547,97.582,97.616,97.651,97.685,97.719,97.754,97.788,97.823,97.857,97.892,97.926,97.961,97.995,98.029,98.064,98.098,98.133,98.167,98.202,98.236,98.271,98.305,98.339,98.374,98.408,98.443,98.477,98.512,98.546,98.581],[96.487,96.521,96.556,96.591,96.625,96.66,96.695,96.729,96.764,96.798,96.833,96.868,96.902,96.937,96.972,97.006,97.041,97.075,97.11,97.145,97.179,97.214,97.249,97.283,97.318,97.353,97.387,97.422,97.456,97.491,97.526,97.56,97.595,97.63,97.664,97.699,97.733,97.768,97.803,97.837,97.872,97.907,97.941,97.976,98.01,98.045,98.08,98.114,98.149,98.184,98.218,98.253,98.288,98.322,98.357,98.391,98.426,98.461,98.495,98.53,98.565,98.599,98.634,98.668],[96.563,96.598,96.632,96.667,96.702,96.737,96.772,96.806,96.841,96.876,96.911,96.946,96.981,97.015,97.05,97.085,97.12,97.155,97.19,97.224,97.259,97.294,97.329,97.364,97.398,97.433,97.468,97.503,97.538,97.573,97.607,97.642,97.677,97.712,97.747,97.781,97.816,97.851,97.886,97.921,97.956,97.99,98.025,98.06,98.095,98.13,98.164,98.199,98.234,98.269,98.304,98.339,98.373,98.408,98.443,98.478,98.513,98.548,98.582,98.617,98.652,98.687,98.722,98.756],[96.639,96.674,96.709,96.744,96.779,96.814,96.849,96.884,96.919,96.954,96.989,97.024,97.059,97.094,97.129,97.164,97.199,97.234,97.269,97.304,97.339,97.374,97.409,97.444,97.479,97.514,97.549,97.584,97.619,97.654,97.689,97.724,97.759,97.794,97.829,97.864,97.899,97.934,97.969,98.004,98.039,98.074,98.109,98.144,98.179,98.214,98.249,98.284,98.319,98.354,98.389,98.424,98.459,98.494,98.529,98.564,98.599,98.634,98.669,98.704,98.739,98.774,98.809,98.844],[96.715,96.75,96.785,96.82,96.856,96.891,96.926,96.961,96.996,97.032,97.067,97.102,97.137,97.172,97.208,97.243,97.278,97.313,97.348,97.384,97.419,97.454,97.489,97.524,97.56,97.595,97.63,97.665,97.7,97.736,97.771,97.806,97.841,97.876,97.912,97.947,97.982,98.017,98.052,98.088,98.123,98.158,98.193,98.228,98.264,98.299,98.334,98.369,98.404,98.44,98.475,98.51,98.545,98.58,98.616,98.651,98.686,98.721,98.756,98.792,98.827,98.862,98.897,98.932],[96.791,96.826,96.861,96.897,96.932,96.968,97.003,97.038,97.074,97.109,97.145,97.18,97.215,97.251,97.286,97.322,97.357,97.392,97.428,97.463,97.499,97.534,97.569,97.605,97.64,97.675,97.711,97.746,97.782,97.817,97.852,97.888,97.923,97.959,97.994,98.029,98.065,98.1,98.136,98.171,98.206,98.242,98.277,98.312,98.348,98.383,98.419,98.454,98.489,98.525,98.56,98.596,98.631,98.666,98.702,98.737,98.773,98.808,98.843,98.879,98.914,98.95,98.985,99.02],[96.867,96.902,96.938,96.973,97.009,97.045,97.08,97.116,97.151,97.187,97.223,97.258,97.294,97.329,97.365,97.4,97.436,97.472,97.507,97.543,97.578,97.614,97.649,97.685,97.721,97.756,97.792,97.827,97.863,97.899,97.934,97.97,98.005,98.041,98.076,98.112,98.148,98.183,98.219,98.254,98.29,98.325,98.361,98.397,98.432,98.468,98.503,98.539,98.575,98.61,98.646,98.681,98.717,98.752,98.788,98.824,98.859,98.895,98.93,98.966,99.002,99.037,99.073,99.108],[96.943,96.978,97.014,97.05,97.086,97.122,97.157,97.193,97.229,97.265,97.3,97.336,97.372,97.408,97.443,97.479,97.515,97.551,97.587,97.622,97.658,97.694,97.73,97.765,97.801,97.837,97.873,97.908,97.944,97.98,98.016,98.052,98.087,98.123,98.159,98.195,98.23,98.266,98.302,98.338,98.374,98.409,98.445,98.481,98.517,98.552,98.588,98.624,98.66,98.695,98.731,98.767,98.803,98.839,98.874,98.91,98.946,98.982,99.017,99.053,99.089,99.125,99.16,99.196],[97.019,97.055,97.091,97.127,97.163,97.198,97.234,97.27,97.306,97.342,97.378,97.414,97.45,97.486,97.522,97.558,97.594,97.63,97.666,97.702,97.738,97.774,97.81,97.846,97.882,97.918,97.954,97.99,98.026,98.062,98.097,98.133,98.169,98.205,98.241,98.277,98.313,98.349,98.385,98.421,98.457,98.493,98.529,98.565,98.601,98.637,98.673,98.709,98.745,98.781,98.817,98.853,98.889,98.925,98.961,98.997,99.032,99.068,99.104,99.14,99.176,99.212,99.248,99.284],[97.095,97.131,97.167,97.203,97.239,97.275,97.312,97.348,97.384,97.42,97.456,97.492,97.528,97.565,97.601,97.637,97.673,97.709,97.745,97.782,97.818,97.854,97.89,97.926,97.962,97.998,98.035,98.071,98.107,98.143,98.179,98.215,98.251,98.288,98.324,98.36,98.396,98.432,98.468,98.505,98.541,98.577,98.613,98.649,98.685,98.721,98.758,98.794,98.83,98.866,98.902,98.938,98.974,99.011,99.047,99.083,99.119,99.155,99.191,99.228,99.264,99.3,99.336,99.372],[97.171,97.207,97.243,97.28,97.316,97.352,97.389,97.425,97.461,97.498,97.534,97.57,97.607,97.643,97.679,97.716,97.752,97.788,97.825,97.861,97.897,97.934,97.97,98.006,98.043,98.079,98.116,98.152,98.188,98.225,98.261,98.297,98.334,98.37,98.406,98.443,98.479,98.515,98.552,98.588,98.624,98.661,98.697,98.733,98.77,98.806,98.842,98.879,98.915,98.951,98.988,99.024,99.06,99.097,99.133,99.169,99.206,99.242,99.278,99.315,99.351,99.387,99.424,99.46],[97.247,97.283,97.32,97.356,97.393,97.429,97.466,97.502,97.539,97.575,97.612,97.648,97.685,97.722,97.758,97.795,97.831,97.868,97.904,97.941,97.977,98.014,98.05,98.087,98.123,98.16,98.196,98.233,98.27,98.306,98.343,98.379,98.416,98.452,98.489,98.525,98.562,98.598,98.635,98.671,98.708,98.744,98.781,98.817,98.854,98.891,98.927,98.964,99.0,99.037,99.073,99.11,99.146,99.183,99.219,99.256,99.292,99.329,99.365,99.402,99.438,99.475,99.512,99.548],[97.323,97.359,97.396,97.433,97.47,97.506,97.543,97.58,97.616,97.653,97.69,97.727,97.763,97.8,97.837,97.873,97.91,97.947,97.984,98.02,98.057,98.094,98.13,98.167,98.204,98.241,98.277,98.314,98.351,98.388,98.424,98.461,98.498,98.534,98.571,98.608,98.645,98.681,98.718,98.755,98.791,98.828,98.865,98.902,98.938,98.975,99.012,99.049,99.085,99.122,99.159,99.195,99.232,99.269,99.306,99.342,99.379,99.416,99.452,99.489,99.526,99.563,99.599,99.636],[97.399,97.436,97.472,97.509,97.546,97.583,97.62,97.657,97.694,97.731,97.768,97.805,97.842,97.878,97.915,97.952,97.989,98.026,98.063,98.1,98.137,98.174,98.211,98.248,98.284,98.321,98.358,98.